****UC-1****

C:\Program Files\MySQL\MySQL Server 8.0\bin>mysql -u root -p
Enter password: **************
Welcome to the MySQL monitor.  Commands end with ; or \g.
Your MySQL connection id is 173
Server version: 8.0.23 MySQL Community Server - GPL

Copyright (c) 2000, 2021, Oracle and/or its affiliates.

Oracle is a registered trademark of Oracle Corporation and/or its
affiliates. Other names may be trademarks of their respective
owners.

Type 'help;' or '\h' for help. Type '\c' to clear the current input statement.

mysql> show database;
ERROR 1064 (42000): You have an error in your SQL syntax; check the manual that corresponds to your MySQL server version for the right syntax to use near 'database' at line 1
mysql> show databases;
+--------------------------+
| Database                 |
+--------------------------+
| employee_payroll_service |
| employeepayroll          |
| information_schema       |
| mysql                    |
| performance_schema       |
| sys                      |
+--------------------------+
6 rows in set (0.03 sec)

mysql> create database AddressBookService;
Query OK, 1 row affected (0.02 sec)

mysql> show databases;
+--------------------------+
| Database                 |
+--------------------------+
| addressbookservice       |
| employee_payroll_service |
| employeepayroll          |
| information_schema       |
| mysql                    |
| performance_schema       |
| sys                      |
+--------------------------+
7 rows in set (0.02 sec)

****UC-2*****
mysql> use  addressbookservice;
Database changed
mysql> use AddressBookService;
Database changed
mysql> create table addressBook (firstName varchar(20), lastName varchar(20), address varchar(100), city varchar(20), state varchar(20), zip int, phoneNumber int, email varchar(50) );
Query OK, 0 rows affected (0.11 sec)

mysql>  describe addressBook;
+-------------+--------------+------+-----+---------+-------+
| Field       | Type         | Null | Key | Default | Extra |
+-------------+--------------+------+-----+---------+-------+
| firstName   | varchar(20)  | YES  |     | NULL    |       |
| lastName    | varchar(20)  | YES  |     | NULL    |       |
| address     | varchar(100) | YES  |     | NULL    |       |
| city        | varchar(20)  | YES  |     | NULL    |       |
| state       | varchar(20)  | YES  |     | NULL    |       |
| zip         | int          | YES  |     | NULL    |       |
| phoneNumber | int          | YES  |     | NULL    |       |
| email       | varchar(50)  | YES  |     | NULL    |       |
+-------------+--------------+------+-----+---------+-------+
8 rows in set (0.02 sec)


****UC-3****
mysql> create table addressBook (firstName varchar(20), lastName varchar(20), address varchar(100), city varchar(20), state varchar(20), zip int, phoneNumber int, email varchar(50) );
Query OK, 0 rows affected (0.11 sec)

mysql>  describe addressBook;
+-------------+--------------+------+-----+---------+-------+
| Field       | Type         | Null | Key | Default | Extra |
+-------------+--------------+------+-----+---------+-------+
| firstName   | varchar(20)  | YES  |     | NULL    |       |
| lastName    | varchar(20)  | YES  |     | NULL    |       |
| address     | varchar(100) | YES  |     | NULL    |       |
| city        | varchar(20)  | YES  |     | NULL    |       |
| state       | varchar(20)  | YES  |     | NULL    |       |
| zip         | int          | YES  |     | NULL    |       |
| phoneNumber | int          | YES  |     | NULL    |       |
| email       | varchar(50)  | YES  |     | NULL    |       |
+-------------+--------------+------+-----+---------+-------+
8 rows in set (0.02 sec)
mysql> insert into addressBook (firstName, lastName, address, city, state, zip, phoneNumber, email) values ("Seema", "Thorat", "Mumbai", "Khed", "Maharastra", 410501, 7787, "Seemagade97@gmail.com");
Query OK, 1 row affected (0.01 sec)

mysql> select * from addressBook;
+-----------+----------+---------+------+------------+--------+-------------+-----------------------+
| firstName | lastName | address | city | state      | zip    | phoneNumber | email                 |
+-----------+----------+---------+------+------------+--------+-------------+-----------------------+
| Seema     | Thorat   | Mumbai  | Khed | Maharastra | 410501 |        7787 | Seemagade97@gmail.com |
+-----------+----------+---------+------+------------+--------+-------------+-----------------------+
1 row in set (0.01 sec)

mysql> insert into addressBook (firstName, lastName, address, city, state, zip, phoneNumber, email) values ("kajal", "gadekar", "Mumbai", "Manchar", "Maharastra", 410502, 9008, "kajal@gmail.com");
Query OK, 1 row affected (0.02 sec)

mysql> select * from addressBook;
+-----------+----------+---------+---------+------------+--------+-------------+-----------------------+
| firstName | lastName | address | city    | state      | zip    | phoneNumber | email                 |
+-----------+----------+---------+---------+------------+--------+-------------+-----------------------+
| Seema     | Thorat   | Mumbai  | Khed    | Maharastra | 410501 |        7787 | Seemagade97@gmail.com |
| kajal     | gadekar  | Mumbai  | Manchar | Maharastra | 410502 |        9008 | kajal@gmail.com       |
+-----------+----------+---------+---------+------------+--------+-------------+-----------------------+
2 rows in set (0.00 sec)


*****UC-4****

mysql> select *from addressBook;
+-----------+----------+---------+---------+------------+--------+-------------+-----------------------+
| firstName | lastName | address | city    | state      | zip    | phoneNumber | email                 |
+-----------+----------+---------+---------+------------+--------+-------------+-----------------------+
| Seema     | Thorat   | Mumbai  | Khed    | Maharastra | 410501 |        7787 | Seemagade97@gmail.com |
| kajal     | gadekar  | Mumbai  | Manchar | Maharastra | 410502 |        9008 | kajal@gmail.com       |
+-----------+----------+---------+---------+------------+--------+-------------+-----------------------+
2 rows in set (0.00 sec)

mysql> update addressBook set address = "Ambegoan" , state = "Pune" where firstName = "kajal";
Query OK, 1 row affected (0.01 sec)
Rows matched: 1  Changed: 1  Warnings: 0

mysql> select * from addressBook;
+-----------+----------+----------+---------+------------+--------+-------------+-----------------------+
| firstName | lastName | address  | city    | state      | zip    | phoneNumber | email                 |
+-----------+----------+----------+---------+------------+--------+-------------+-----------------------+
| Seema     | Thorat   | Mumbai   | Khed    | Maharastra | 410501 |        7787 | Seemagade97@gmail.com |
| kajal     | gadekar  | Ambegoan | Manchar | Pune       | 410502 |        9008 | kajal@gmail.com       |
+-----------+----------+----------+---------+------------+--------+-------------+-----------------------+
2 rows in set (0.01 sec)

***UC-5****
mysql> select * from addressBook;
+-----------+----------+----------+---------+------------+--------+-------------+-----------------------+
| firstName | lastName | address  | city    | state      | zip    | phoneNumber | email                 |
+-----------+----------+----------+---------+------------+--------+-------------+-----------------------+
| Seema     | Thorat   | Mumbai   | Khed    | Maharastra | 410501 |        7787 | Seemagade97@gmail.com |
| kajal     | gadekar  | Ambegoan | Manchar | Pune       | 410502 |        9008 | kajal@gmail.com       |
+-----------+----------+----------+---------+------------+--------+-------------+-----------------------+
2 rows in set (0.01 sec)

mysql> select *from addressBook;
+-----------+----------+----------+---------+------------+--------+-------------+-----------------------+
| firstName | lastName | address  | city    | state      | zip    | phoneNumber | email                 |
+-----------+----------+----------+---------+------------+--------+-------------+-----------------------+
| Seema     | Thorat   | Mumbai   | Khed    | Maharastra | 410501 |        7787 | Seemagade97@gmail.com |
| kajal     | gadekar  | Ambegoan | Manchar | Pune       | 410502 |        9008 | kajal@gmail.com       |
+-----------+----------+----------+---------+------------+--------+-------------+-----------------------+
2 rows in set (0.00 sec)

mysql> insert into addressBook (firstName, lastName, address, city, state, zip, phoneNumber, email) values ("Rani", "Erande", "Kalus", "Manchar", "Maharastra", 410502, 9008, "Rani@gmail.com");
Query OK, 1 row affected (0.01 sec)

mysql> select *from addressBook;
+-----------+----------+----------+---------+------------+--------+-------------+-----------------------+
| firstName | lastName | address  | city    | state      | zip    | phoneNumber | email                 |
+-----------+----------+----------+---------+------------+--------+-------------+-----------------------+
| Seema     | Thorat   | Mumbai   | Khed    | Maharastra | 410501 |        7787 | Seemagade97@gmail.com |
| kajal     | gadekar  | Ambegoan | Manchar | Pune       | 410502 |        9008 | kajal@gmail.com       |
| Rani      | Erande   | Kalus    | Manchar | Maharastra | 410502 |        9008 | Rani@gmail.com        |
+-----------+----------+----------+---------+------------+--------+-------------+-----------------------+
3 rows in set (0.01 sec)

mysql> delete from addressBook where name = "Rani";
ERROR 1054 (42S22): Unknown column 'name' in 'where clause'
mysql> delete from addressBook where firstName = "Rani";
Query OK, 1 row affected (0.01 sec)

mysql> select *from addressBook;
+-----------+----------+----------+---------+------------+--------+-------------+-----------------------+
| firstName | lastName | address  | city    | state      | zip    | phoneNumber | email                 |
+-----------+----------+----------+---------+------------+--------+-------------+-----------------------+
| Seema     | Thorat   | Mumbai   | Khed    | Maharastra | 410501 |        7787 | Seemagade97@gmail.com |
| kajal     | gadekar  | Ambegoan | Manchar | Pune       | 410502 |        9008 | kajal@gmail.com       |
+-----------+----------+----------+---------+------------+--------+-------------+-----------------------+
2 rows in set (0.00 sec)
